,Document,Topic,Name,Representation,Representative_Docs,Top_n_words,Probability,Representative_document
208,"EnBW: EnBW is rank among the largest energy supply companies in Germany., SaaS, New Mobility, Digital Transformation",3,3_energy_gas_and_electricity,"['energy', 'gas', 'and', 'electricity', 'is', 'company', 'transformation', 'water', 'digital', 'the']","['Engie: ENGIE is a global energy player and an expert operator in the three key sectors of electricity, natural gas and energy services., Automation, Digital Transformation, Other', 'Veolia: Veolia group is the global leader in optimized resource management. With nearly 179,000 employees worldwide, the Group designs and provides water, waste and energy management solutions which contribute to the sustainable development of communities and industries. Through its three complementary business activities, Veolia helps to develop access to resources, preserve available resources, and to replenish them. In 2019, the Veolia group supplied 98 million people with drinking water and 67 million people with wastewater service, produced nearly 45 million megawatt hours of energy and treated 50 million metric tons of waste. Veolia Environnement (listed on Paris Euronext: VIE) recorded consolidated revenue of €27.189 billion in 2019 (USD 29.9 billion)., Digital Transformation, Automation, Smart Supply Chain', 'Equinor: Equinor is an energy company that specializes in providing oil, gas, wind energy, and solar power energy., Other, CleanTech, FinTech']",energy - gas - and - electricity - is - company - transformation - water - digital - the,1.0,False
209,"Equinor: Equinor is an energy company that specializes in providing oil, gas, wind energy, and solar power energy., Other, CleanTech, FinTech",3,3_energy_gas_and_electricity,"['energy', 'gas', 'and', 'electricity', 'is', 'company', 'transformation', 'water', 'digital', 'the']","['Engie: ENGIE is a global energy player and an expert operator in the three key sectors of electricity, natural gas and energy services., Automation, Digital Transformation, Other', 'Veolia: Veolia group is the global leader in optimized resource management. With nearly 179,000 employees worldwide, the Group designs and provides water, waste and energy management solutions which contribute to the sustainable development of communities and industries. Through its three complementary business activities, Veolia helps to develop access to resources, preserve available resources, and to replenish them. In 2019, the Veolia group supplied 98 million people with drinking water and 67 million people with wastewater service, produced nearly 45 million megawatt hours of energy and treated 50 million metric tons of waste. Veolia Environnement (listed on Paris Euronext: VIE) recorded consolidated revenue of €27.189 billion in 2019 (USD 29.9 billion)., Digital Transformation, Automation, Smart Supply Chain', 'Equinor: Equinor is an energy company that specializes in providing oil, gas, wind energy, and solar power energy., Other, CleanTech, FinTech']",energy - gas - and - electricity - is - company - transformation - water - digital - the,0.68722565671844,True
210,"Everest: Everest manufactures windows, doors & conservatories., Automation, Sharing Economy, New Mobility",4,4_cars_industry_of_manufacturer,"['cars', 'industry', 'of', 'manufacturer', '40', 'other', 'automotive', 'and', 'transformation', 'digital']","['Volkswagen: Leading German automotive manufacturer, Digital Transformation, Automation, Industry 4.0', 'Porsche: Leading manufacturer of high quality cars, Other, Automation, Digital Transformation', 'Daimler: Producer of premium cars and manufacturer of commercial vehicles, Other, Digital Transformation, Automation']",cars - industry - of - manufacturer - 40 - other - automotive - and - transformation - digital,0.7051684897670412,False
211,"Fresenius Medical Care: Fresenius Medical Care is a healthcare company that provides dialysis treatment for those with chronic kidney diseases., Digital Transformation, Future of Work, Automation",2,2_healthtech_health_and_medical,"['healthtech', 'health', 'and', 'medical', 'healthcare', 'digital', 'transformation', 'in', 'the', 'pharmaceutical']","['Novo Nordisk: Novo Nordisk is a global healthcare company with more than 90 years of innovation and leadership in diabetes care., HealthTech, Health Care', 'University Medical Center Groningen: University Medical Center Groningen is a hospital in Groningen, The Netherlands. Its core tasks are academic health care, medical education., HealthTech, Automation', 'Fresenius Medical Care: Fresenius Medical Care is a healthcare company that provides dialysis treatment for those with chronic kidney diseases., Digital Transformation, Future of Work, Automation']",healthtech - health - and - medical - healthcare - digital - transformation - in - the - pharmaceutical,0.6135846595638146,True
212,"Galderma: Galderma offering a range of medical and consumer skin health solutions through three business units., HealthTech, Automation",2,2_healthtech_health_and_medical,"['healthtech', 'health', 'and', 'medical', 'healthcare', 'digital', 'transformation', 'in', 'the', 'pharmaceutical']","['Novo Nordisk: Novo Nordisk is a global healthcare company with more than 90 years of innovation and leadership in diabetes care., HealthTech, Health Care', 'University Medical Center Groningen: University Medical Center Groningen is a hospital in Groningen, The Netherlands. Its core tasks are academic health care, medical education., HealthTech, Automation', 'Fresenius Medical Care: Fresenius Medical Care is a healthcare company that provides dialysis treatment for those with chronic kidney diseases., Digital Transformation, Future of Work, Automation']",healthtech - health - and - medical - healthcare - digital - transformation - in - the - pharmaceutical,1.0,False
213,"Gemalto: Gemalto is a digital security company that offers mobile connectivity, payment technology, and data protection solutions to manage services., FinTech, New Mobility, Industry 4.0",1,1_bank_fintech_financial_banking,"['bank', 'fintech', 'financial', 'banking', 'services', 'payments', 'is', 'digital', 'of', 'transformation']","['HSBC: Is a British multinational banking and financial services company, Digital Transformation, Automation, FinTech', 'The Royal Bank of Scotland: The Royal Bank of Scotland is a bank providing retail banking services throughout the United Kingdom and Ireland.\xa0, Other, FinTech, Automation', 'Deutsche Bank: Global investment bank, offers financial products and services to corporate and institutional clients, FinTech, Automation, Digital Transformation']",bank - fintech - financial - banking - services - payments - is - digital - of - transformation,0.4082536929318911,False
214,"Geodis: Geodis provides transportation and logistics services in France, Europe, Southeast Asia, Africa, and Latin America., Automation, Industry 4.0, Safety",6,6_transport_travel_rail_air,"['transport', 'travel', 'rail', 'air', 'airline', 'the', 'and', 'of', 'mobility', 'airlines']","['SITA: SITA is an air transport IT and communications specialist, providing IT and telecommunication services to the air transport industry., Cybersecurity, Automation', 'Iberia: Iberia operates a commercial airline and travel service for clients in Latin America and the rest of the world., Digital Transformation, Other', 'Renfe: Renfe is a service rail transport of passengers and goods under the Ministry of Development., New Mobility']",transport - travel - rail - air - airline - the - and - of - mobility - airlines,0.7982693009429217,False
215,"Getinge: Getinge identifies customer issues and promotes clinical and economic benefits and follow and support the customer decision process., Digital Transformation, LegalTech, Digitalization",2,2_healthtech_health_and_medical,"['healthtech', 'health', 'and', 'medical', 'healthcare', 'digital', 'transformation', 'in', 'the', 'pharmaceutical']","['Novo Nordisk: Novo Nordisk is a global healthcare company with more than 90 years of innovation and leadership in diabetes care., HealthTech, Health Care', 'University Medical Center Groningen: University Medical Center Groningen is a hospital in Groningen, The Netherlands. Its core tasks are academic health care, medical education., HealthTech, Automation', 'Fresenius Medical Care: Fresenius Medical Care is a healthcare company that provides dialysis treatment for those with chronic kidney diseases., Digital Transformation, Future of Work, Automation']",healthtech - health - and - medical - healthcare - digital - transformation - in - the - pharmaceutical,0.499929362272956,False
216,"Glencore: Glencore operates various commodity industries include coal, copper, cotton, grain and oilseeds, nickel and zinc., Automation, Other, Digital Transformation",-1,-1_and_is_automation_digital,"['and', 'is', 'automation', 'digital', 'of', 'transformation', 'the', 'in', 'for', 'other']","['Business France: Business France is the national agency responsible for the development of exports and international investment in France., Future of Work, Automation', 'Tesa: Tesa AG manufactures and markets self-adhesive products and system solutions for industry, trade, and consumer sectors worldwide., Future of Work, Digital Transformation, Automation', 'Smart: Smart offers its members with solutions to create a salaried job and a range of services in legal, financial, training and administration., CleanTech, Future of Work, Digital Transformation']",and - is - automation - digital - of - transformation - the - in - for - other,0.0,False
217,"Global: Global is a media and entertainment company that operates commercial radio stations., Digital Transformation, HealthTech, CleanTech",2,2_healthtech_health_and_medical,"['healthtech', 'health', 'and', 'medical', 'healthcare', 'digital', 'transformation', 'in', 'the', 'pharmaceutical']","['Novo Nordisk: Novo Nordisk is a global healthcare company with more than 90 years of innovation and leadership in diabetes care., HealthTech, Health Care', 'University Medical Center Groningen: University Medical Center Groningen is a hospital in Groningen, The Netherlands. Its core tasks are academic health care, medical education., HealthTech, Automation', 'Fresenius Medical Care: Fresenius Medical Care is a healthcare company that provides dialysis treatment for those with chronic kidney diseases., Digital Transformation, Future of Work, Automation']",healthtech - health - and - medical - healthcare - digital - transformation - in - the - pharmaceutical,0.6882783898994219,False
218,"Grundfos: Grundfos is a pump manufacturer, based in Denmark, Automation, Future of Work",3,3_energy_gas_and_electricity,"['energy', 'gas', 'and', 'electricity', 'is', 'company', 'transformation', 'water', 'digital', 'the']","['Engie: ENGIE is a global energy player and an expert operator in the three key sectors of electricity, natural gas and energy services., Automation, Digital Transformation, Other', 'Veolia: Veolia group is the global leader in optimized resource management. With nearly 179,000 employees worldwide, the Group designs and provides water, waste and energy management solutions which contribute to the sustainable development of communities and industries. Through its three complementary business activities, Veolia helps to develop access to resources, preserve available resources, and to replenish them. In 2019, the Veolia group supplied 98 million people with drinking water and 67 million people with wastewater service, produced nearly 45 million megawatt hours of energy and treated 50 million metric tons of waste. Veolia Environnement (listed on Paris Euronext: VIE) recorded consolidated revenue of €27.189 billion in 2019 (USD 29.9 billion)., Digital Transformation, Automation, Smart Supply Chain', 'Equinor: Equinor is an energy company that specializes in providing oil, gas, wind energy, and solar power energy., Other, CleanTech, FinTech']",energy - gas - and - electricity - is - company - transformation - water - digital - the,0.47990737645291226,False
219,"Halifax: Halifax is a banking chain in the United Kingdom., Digital Transformation, FinTech, Future of Work",1,1_bank_fintech_financial_banking,"['bank', 'fintech', 'financial', 'banking', 'services', 'payments', 'is', 'digital', 'of', 'transformation']","['HSBC: Is a British multinational banking and financial services company, Digital Transformation, Automation, FinTech', 'The Royal Bank of Scotland: The Royal Bank of Scotland is a bank providing retail banking services throughout the United Kingdom and Ireland.\xa0, Other, FinTech, Automation', 'Deutsche Bank: Global investment bank, offers financial products and services to corporate and institutional clients, FinTech, Automation, Digital Transformation']",bank - fintech - financial - banking - services - payments - is - digital - of - transformation,1.0,False
220,"Heidelberg Cement: With a Group revenue of €13.5 billion in 2015, HeidelbergCement is one of the world’s largest building materials companies., Automation, Digitalization, Other",-1,-1_and_is_automation_digital,"['and', 'is', 'automation', 'digital', 'of', 'transformation', 'the', 'in', 'for', 'other']","['Business France: Business France is the national agency responsible for the development of exports and international investment in France., Future of Work, Automation', 'Tesa: Tesa AG manufactures and markets self-adhesive products and system solutions for industry, trade, and consumer sectors worldwide., Future of Work, Digital Transformation, Automation', 'Smart: Smart offers its members with solutions to create a salaried job and a range of services in legal, financial, training and administration., CleanTech, Future of Work, Digital Transformation']",and - is - automation - digital - of - transformation - the - in - for - other,0.0,False
221,"Hermes Group: Hermes provides a range of flexible and affordable delivery options that are convenient for the consumer., MarTech, Digital Transformation, New Mobility",0,0_and_food_is_the,"['and', 'food', 'is', 'the', 'that', 'of', 'automation', 'products', 'in', 'stores']","['Lesara: Lesara is the leading global agile retail pioneer for amazing fashion merchandise at best prices.\r\n\r\nThe company has offices in China and Germany and since its launch in 2013 expanded into 24 markets in 7 languages across Europe, grew its assortment to more than 100.000 SKUs and the the team to over 300 employees.\r\n\r\nLesara is operating a completely vertically integrated supply chain and needs only 2 weeks from idea over design, production to product go-live for its collections.\r\n\r\nThe company was awarded as fastest growing tech-company in Europe in 2016., Digitalization', 'Next: Next is engages in the retail of clothing, footwear, accessories, and home products for men, women, and children., Automation, Digital Transformation, HealthTech', 's.Oliver: s.Oliver is an online shop for apparel and fashion., Automation, Digital Transformation, Future of Work']",and - food - is - the - that - of - automation - products - in - stores,0.811855808163508,False
222,"idealo: Germany's price comparison site with 199M offerings from more than 34K online shops, Automation, MarTech, MarkTech",-1,-1_and_is_automation_digital,"['and', 'is', 'automation', 'digital', 'of', 'transformation', 'the', 'in', 'for', 'other']","['Business France: Business France is the national agency responsible for the development of exports and international investment in France., Future of Work, Automation', 'Tesa: Tesa AG manufactures and markets self-adhesive products and system solutions for industry, trade, and consumer sectors worldwide., Future of Work, Digital Transformation, Automation', 'Smart: Smart offers its members with solutions to create a salaried job and a range of services in legal, financial, training and administration., CleanTech, Future of Work, Digital Transformation']",and - is - automation - digital - of - transformation - the - in - for - other,0.0,False
223,"IDEMIA: IDEMIA offers identity and security solutions for an increasingly digital and connected world., Digital Transformation, FinTech, Safety",-1,-1_and_is_automation_digital,"['and', 'is', 'automation', 'digital', 'of', 'transformation', 'the', 'in', 'for', 'other']","['Business France: Business France is the national agency responsible for the development of exports and international investment in France., Future of Work, Automation', 'Tesa: Tesa AG manufactures and markets self-adhesive products and system solutions for industry, trade, and consumer sectors worldwide., Future of Work, Digital Transformation, Automation', 'Smart: Smart offers its members with solutions to create a salaried job and a range of services in legal, financial, training and administration., CleanTech, Future of Work, Digital Transformation']",and - is - automation - digital - of - transformation - the - in - for - other,0.0,False
224,"Informa: Informa is a business intelligence, academic publishing, knowledge and events group., Automation, New Mobility",-1,-1_and_is_automation_digital,"['and', 'is', 'automation', 'digital', 'of', 'transformation', 'the', 'in', 'for', 'other']","['Business France: Business France is the national agency responsible for the development of exports and international investment in France., Future of Work, Automation', 'Tesa: Tesa AG manufactures and markets self-adhesive products and system solutions for industry, trade, and consumer sectors worldwide., Future of Work, Digital Transformation, Automation', 'Smart: Smart offers its members with solutions to create a salaried job and a range of services in legal, financial, training and administration., CleanTech, Future of Work, Digital Transformation']",and - is - automation - digital - of - transformation - the - in - for - other,0.0,False
225,"Ipsos: Ipsos is a global market research company specialized in advertising, loyalty, marketing, media, and public affairs market research., Automation, FinTech, Other",-1,-1_and_is_automation_digital,"['and', 'is', 'automation', 'digital', 'of', 'transformation', 'the', 'in', 'for', 'other']","['Business France: Business France is the national agency responsible for the development of exports and international investment in France., Future of Work, Automation', 'Tesa: Tesa AG manufactures and markets self-adhesive products and system solutions for industry, trade, and consumer sectors worldwide., Future of Work, Digital Transformation, Automation', 'Smart: Smart offers its members with solutions to create a salaried job and a range of services in legal, financial, training and administration., CleanTech, Future of Work, Digital Transformation']",and - is - automation - digital - of - transformation - the - in - for - other,0.0,False
226,"Kone Oyj: Kone is to make the world’s cities, buildings and public spaces, they believe that cities of the solution for a better future., Future of Work, Automation, RegTech",-1,-1_and_is_automation_digital,"['and', 'is', 'automation', 'digital', 'of', 'transformation', 'the', 'in', 'for', 'other']","['Business France: Business France is the national agency responsible for the development of exports and international investment in France., Future of Work, Automation', 'Tesa: Tesa AG manufactures and markets self-adhesive products and system solutions for industry, trade, and consumer sectors worldwide., Future of Work, Digital Transformation, Automation', 'Smart: Smart offers its members with solutions to create a salaried job and a range of services in legal, financial, training and administration., CleanTech, Future of Work, Digital Transformation']",and - is - automation - digital - of - transformation - the - in - for - other,0.0,False
227,"L'express: L'express is a French weekly news magazine headquartered in Paris., PropTech, Digital Transformation, Cybersecurity",-1,-1_and_is_automation_digital,"['and', 'is', 'automation', 'digital', 'of', 'transformation', 'the', 'in', 'for', 'other']","['Business France: Business France is the national agency responsible for the development of exports and international investment in France., Future of Work, Automation', 'Tesa: Tesa AG manufactures and markets self-adhesive products and system solutions for industry, trade, and consumer sectors worldwide., Future of Work, Digital Transformation, Automation', 'Smart: Smart offers its members with solutions to create a salaried job and a range of services in legal, financial, training and administration., CleanTech, Future of Work, Digital Transformation']",and - is - automation - digital - of - transformation - the - in - for - other,0.0,False
228,"Louvre Hotels Group: Established in 1976, Louvre Hotels Group has a network of more than 1,100 hotels in 46 countries., Automation, Digital Transformation",-1,-1_and_is_automation_digital,"['and', 'is', 'automation', 'digital', 'of', 'transformation', 'the', 'in', 'for', 'other']","['Business France: Business France is the national agency responsible for the development of exports and international investment in France., Future of Work, Automation', 'Tesa: Tesa AG manufactures and markets self-adhesive products and system solutions for industry, trade, and consumer sectors worldwide., Future of Work, Digital Transformation, Automation', 'Smart: Smart offers its members with solutions to create a salaried job and a range of services in legal, financial, training and administration., CleanTech, Future of Work, Digital Transformation']",and - is - automation - digital - of - transformation - the - in - for - other,0.0,False
229,"MAIF: MAIF offers liability insurance to its residents who are unable to obtain automobile insurance in the private market., InsurTech, Automation, Digital Transformation",7,7_insurance_insurtech_group_and,"['insurance', 'insurtech', 'group', 'and', 'direct', 'transformation', 'life', 'services', 'digital', 'fintech']","['Achmea: Achmea is an insurance company that provides its clients with health, life, and non-life insurance services., Digital Transformation, HealthTech, InsurTech', ""Lloyd's: Lloyd’s is the world’s specialist insurance market., InsurTech, FinTech, Digital Transformation"", 'Zurich Insurance Group: The Zurich Insurance Group is a multi-line insurance provider that delivers general insurance and life insurance products and services., Digital Transformation, Automation, InsurTech']",insurance - insurtech - group - and - direct - transformation - life - services - digital - fintech,0.9867823465391071,False
230,"Maserati: Maserati manufactures and sells a range of European automobiles., Digital Transformation, MarTech, FinTech",-1,-1_and_is_automation_digital,"['and', 'is', 'automation', 'digital', 'of', 'transformation', 'the', 'in', 'for', 'other']","['Business France: Business France is the national agency responsible for the development of exports and international investment in France., Future of Work, Automation', 'Tesa: Tesa AG manufactures and markets self-adhesive products and system solutions for industry, trade, and consumer sectors worldwide., Future of Work, Digital Transformation, Automation', 'Smart: Smart offers its members with solutions to create a salaried job and a range of services in legal, financial, training and administration., CleanTech, Future of Work, Digital Transformation']",and - is - automation - digital - of - transformation - the - in - for - other,0.0,False
231,"T-Systems: T-Systems provides information and communication technology (ICT) to multi-group public institutions and agencies., Automation, Digital Transformation, Smart Supply Chain",-1,-1_and_is_automation_digital,"['and', 'is', 'automation', 'digital', 'of', 'transformation', 'the', 'in', 'for', 'other']","['Business France: Business France is the national agency responsible for the development of exports and international investment in France., Future of Work, Automation', 'Tesa: Tesa AG manufactures and markets self-adhesive products and system solutions for industry, trade, and consumer sectors worldwide., Future of Work, Digital Transformation, Automation', 'Smart: Smart offers its members with solutions to create a salaried job and a range of services in legal, financial, training and administration., CleanTech, Future of Work, Digital Transformation']",and - is - automation - digital - of - transformation - the - in - for - other,0.0,False
232,"Monoprix: Monoprix SA is engaged in retail distribution through department store chains including the Monoprix, Super Monoprix, Inno and Prisunic., Digital Transformation, Automation, New Mobility",0,0_and_food_is_the,"['and', 'food', 'is', 'the', 'that', 'of', 'automation', 'products', 'in', 'stores']","['Lesara: Lesara is the leading global agile retail pioneer for amazing fashion merchandise at best prices.\r\n\r\nThe company has offices in China and Germany and since its launch in 2013 expanded into 24 markets in 7 languages across Europe, grew its assortment to more than 100.000 SKUs and the the team to over 300 employees.\r\n\r\nLesara is operating a completely vertically integrated supply chain and needs only 2 weeks from idea over design, production to product go-live for its collections.\r\n\r\nThe company was awarded as fastest growing tech-company in Europe in 2016., Digitalization', 'Next: Next is engages in the retail of clothing, footwear, accessories, and home products for men, women, and children., Automation, Digital Transformation, HealthTech', 's.Oliver: s.Oliver is an online shop for apparel and fashion., Automation, Digital Transformation, Future of Work']",and - food - is - the - that - of - automation - products - in - stores,0.9962770623478676,False
