,Document,Topic,Name,Representation,Representative_Docs,Top_n_words,Probability,Representative_document
414,"Circle: Circle provides medical and health care services., Security, Safety, HealthTech",2,2_healthtech_health_and_medical,"['healthtech', 'health', 'and', 'medical', 'healthcare', 'digital', 'transformation', 'in', 'the', 'pharmaceutical']","['Novo Nordisk: Novo Nordisk is a global healthcare company with more than 90 years of innovation and leadership in diabetes care., HealthTech, Health Care', 'University Medical Center Groningen: University Medical Center Groningen is a hospital in Groningen, The Netherlands. Its core tasks are academic health care, medical education., HealthTech, Automation', 'Fresenius Medical Care: Fresenius Medical Care is a healthcare company that provides dialysis treatment for those with chronic kidney diseases., Digital Transformation, Future of Work, Automation']",healthtech - health - and - medical - healthcare - digital - transformation - in - the - pharmaceutical,0.8268362202917722,False
415,"Clarion Events: Clarion Events can trace its roots back to 1947 and takes great pride in being one of the oldest independent event organisers., Automation, Future of Work",-1,-1_and_is_automation_digital,"['and', 'is', 'automation', 'digital', 'of', 'transformation', 'the', 'in', 'for', 'other']","['Business France: Business France is the national agency responsible for the development of exports and international investment in France., Future of Work, Automation', 'Tesa: Tesa AG manufactures and markets self-adhesive products and system solutions for industry, trade, and consumer sectors worldwide., Future of Work, Digital Transformation, Automation', 'Smart: Smart offers its members with solutions to create a salaried job and a range of services in legal, financial, training and administration., CleanTech, Future of Work, Digital Transformation']",and - is - automation - digital - of - transformation - the - in - for - other,0.0,False
416,"CMA CGM: CMA CGM is a shipping company that ships fleets, containers, and cargo., HealthTech, Other",-1,-1_and_is_automation_digital,"['and', 'is', 'automation', 'digital', 'of', 'transformation', 'the', 'in', 'for', 'other']","['Business France: Business France is the national agency responsible for the development of exports and international investment in France., Future of Work, Automation', 'Tesa: Tesa AG manufactures and markets self-adhesive products and system solutions for industry, trade, and consumer sectors worldwide., Future of Work, Digital Transformation, Automation', 'Smart: Smart offers its members with solutions to create a salaried job and a range of services in legal, financial, training and administration., CleanTech, Future of Work, Digital Transformation']",and - is - automation - digital - of - transformation - the - in - for - other,0.0,False
417,"Colruyt Group: Colruyt Group is a family-owned retail company that operates in the food and non-food distribution sector., Digital Transformation",0,0_and_food_is_the,"['and', 'food', 'is', 'the', 'that', 'of', 'automation', 'products', 'in', 'stores']","['Lesara: Lesara is the leading global agile retail pioneer for amazing fashion merchandise at best prices.\r\n\r\nThe company has offices in China and Germany and since its launch in 2013 expanded into 24 markets in 7 languages across Europe, grew its assortment to more than 100.000 SKUs and the the team to over 300 employees.\r\n\r\nLesara is operating a completely vertically integrated supply chain and needs only 2 weeks from idea over design, production to product go-live for its collections.\r\n\r\nThe company was awarded as fastest growing tech-company in Europe in 2016., Digitalization', 'Next: Next is engages in the retail of clothing, footwear, accessories, and home products for men, women, and children., Automation, Digital Transformation, HealthTech', 's.Oliver: s.Oliver is an online shop for apparel and fashion., Automation, Digital Transformation, Future of Work']",and - food - is - the - that - of - automation - products - in - stores,0.8285911220091673,False
418,"Covestro: Covestro is a supplier of high-tech polymer materials., Automation, Future of Work",-1,-1_and_is_automation_digital,"['and', 'is', 'automation', 'digital', 'of', 'transformation', 'the', 'in', 'for', 'other']","['Business France: Business France is the national agency responsible for the development of exports and international investment in France., Future of Work, Automation', 'Tesa: Tesa AG manufactures and markets self-adhesive products and system solutions for industry, trade, and consumer sectors worldwide., Future of Work, Digital Transformation, Automation', 'Smart: Smart offers its members with solutions to create a salaried job and a range of services in legal, financial, training and administration., CleanTech, Future of Work, Digital Transformation']",and - is - automation - digital - of - transformation - the - in - for - other,0.0,False
419,"Covidien: Global Healthcare Products Leader, Other, HealthTech",2,2_healthtech_health_and_medical,"['healthtech', 'health', 'and', 'medical', 'healthcare', 'digital', 'transformation', 'in', 'the', 'pharmaceutical']","['Novo Nordisk: Novo Nordisk is a global healthcare company with more than 90 years of innovation and leadership in diabetes care., HealthTech, Health Care', 'University Medical Center Groningen: University Medical Center Groningen is a hospital in Groningen, The Netherlands. Its core tasks are academic health care, medical education., HealthTech, Automation', 'Fresenius Medical Care: Fresenius Medical Care is a healthcare company that provides dialysis treatment for those with chronic kidney diseases., Digital Transformation, Future of Work, Automation']",healthtech - health - and - medical - healthcare - digital - transformation - in - the - pharmaceutical,1.0,False
420,"Creditsafe: Creditsafe Business Solutions provides financial information, company status and credit reports of businesses., Digital Transformation, FinTech",1,1_bank_fintech_financial_banking,"['bank', 'fintech', 'financial', 'banking', 'services', 'payments', 'is', 'digital', 'of', 'transformation']","['HSBC: Is a British multinational banking and financial services company, Digital Transformation, Automation, FinTech', 'The Royal Bank of Scotland: The Royal Bank of Scotland is a bank providing retail banking services throughout the United Kingdom and Ireland.\xa0, Other, FinTech, Automation', 'Deutsche Bank: Global investment bank, offers financial products and services to corporate and institutional clients, FinTech, Automation, Digital Transformation']",bank - fintech - financial - banking - services - payments - is - digital - of - transformation,0.47690658482614534,False
421,"CTS Eventim: CTS Eventim operates in the leisure events market worldwide., Automation, MarTech",6,6_transport_travel_rail_air,"['transport', 'travel', 'rail', 'air', 'airline', 'the', 'and', 'of', 'mobility', 'airlines']","['SITA: SITA is an air transport IT and communications specialist, providing IT and telecommunication services to the air transport industry., Cybersecurity, Automation', 'Iberia: Iberia operates a commercial airline and travel service for clients in Latin America and the rest of the world., Digital Transformation, Other', 'Renfe: Renfe is a service rail transport of passengers and goods under the Ministry of Development., New Mobility']",transport - travel - rail - air - airline - the - and - of - mobility - airlines,0.7361487885556368,False
422,"Cyfrowy Polsat S.A.: Poland's leading media and telecommunications group - listed in Warsaw (WSE:CPS), controlled by Polish billionaire Mr Zygmunt Solorz-Żak, Automation, Digital Transformation",-1,-1_and_is_automation_digital,"['and', 'is', 'automation', 'digital', 'of', 'transformation', 'the', 'in', 'for', 'other']","['Business France: Business France is the national agency responsible for the development of exports and international investment in France., Future of Work, Automation', 'Tesa: Tesa AG manufactures and markets self-adhesive products and system solutions for industry, trade, and consumer sectors worldwide., Future of Work, Digital Transformation, Automation', 'Smart: Smart offers its members with solutions to create a salaried job and a range of services in legal, financial, training and administration., CleanTech, Future of Work, Digital Transformation']",and - is - automation - digital - of - transformation - the - in - for - other,0.0,False
423,"CzechInvest: CzechInvest is the investment and business development agency of the Czech Republic, providing services to attract foreign investment., Digital Transformation, Future of Work",-1,-1_and_is_automation_digital,"['and', 'is', 'automation', 'digital', 'of', 'transformation', 'the', 'in', 'for', 'other']","['Business France: Business France is the national agency responsible for the development of exports and international investment in France., Future of Work, Automation', 'Tesa: Tesa AG manufactures and markets self-adhesive products and system solutions for industry, trade, and consumer sectors worldwide., Future of Work, Digital Transformation, Automation', 'Smart: Smart offers its members with solutions to create a salaried job and a range of services in legal, financial, training and administration., CleanTech, Future of Work, Digital Transformation']",and - is - automation - digital - of - transformation - the - in - for - other,0.0,False
424,"Dalkia: Dalkia is an energy service company that offers management and maintenance services to operators of industrial production sites., RegTech, Digital Transformation, Smart Supply Chain",3,3_energy_gas_and_electricity,"['energy', 'gas', 'and', 'electricity', 'is', 'company', 'transformation', 'water', 'digital', 'the']","['Engie: ENGIE is a global energy player and an expert operator in the three key sectors of electricity, natural gas and energy services., Automation, Digital Transformation, Other', 'Veolia: Veolia group is the global leader in optimized resource management. With nearly 179,000 employees worldwide, the Group designs and provides water, waste and energy management solutions which contribute to the sustainable development of communities and industries. Through its three complementary business activities, Veolia helps to develop access to resources, preserve available resources, and to replenish them. In 2019, the Veolia group supplied 98 million people with drinking water and 67 million people with wastewater service, produced nearly 45 million megawatt hours of energy and treated 50 million metric tons of waste. Veolia Environnement (listed on Paris Euronext: VIE) recorded consolidated revenue of €27.189 billion in 2019 (USD 29.9 billion)., Digital Transformation, Automation, Smart Supply Chain', 'Equinor: Equinor is an energy company that specializes in providing oil, gas, wind energy, and solar power energy., Other, CleanTech, FinTech']",energy - gas - and - electricity - is - company - transformation - water - digital - the,1.0,False
425,"Damm: Damm is the idea of brewing a beer adapted to the Mediterranean climate., Digital Transformation, Automation",-1,-1_and_is_automation_digital,"['and', 'is', 'automation', 'digital', 'of', 'transformation', 'the', 'in', 'for', 'other']","['Business France: Business France is the national agency responsible for the development of exports and international investment in France., Future of Work, Automation', 'Tesa: Tesa AG manufactures and markets self-adhesive products and system solutions for industry, trade, and consumer sectors worldwide., Future of Work, Digital Transformation, Automation', 'Smart: Smart offers its members with solutions to create a salaried job and a range of services in legal, financial, training and administration., CleanTech, Future of Work, Digital Transformation']",and - is - automation - digital - of - transformation - the - in - for - other,0.0,False
426,"Debenhams: Debenhams is a international, multi-channel brand with a proud British heritage which trades out of 240 stores across 28 countries., FinTech, Automation, Smart Supply Chain",0,0_and_food_is_the,"['and', 'food', 'is', 'the', 'that', 'of', 'automation', 'products', 'in', 'stores']","['Lesara: Lesara is the leading global agile retail pioneer for amazing fashion merchandise at best prices.\r\n\r\nThe company has offices in China and Germany and since its launch in 2013 expanded into 24 markets in 7 languages across Europe, grew its assortment to more than 100.000 SKUs and the the team to over 300 employees.\r\n\r\nLesara is operating a completely vertically integrated supply chain and needs only 2 weeks from idea over design, production to product go-live for its collections.\r\n\r\nThe company was awarded as fastest growing tech-company in Europe in 2016., Digitalization', 'Next: Next is engages in the retail of clothing, footwear, accessories, and home products for men, women, and children., Automation, Digital Transformation, HealthTech', 's.Oliver: s.Oliver is an online shop for apparel and fashion., Automation, Digital Transformation, Future of Work']",and - food - is - the - that - of - automation - products - in - stores,1.0,False
427,"Genesis: Genesis is a global Internet company that has developed a number of sizable and fast-growing internet projects., FinTech, Luxury, CleanTech",-1,-1_and_is_automation_digital,"['and', 'is', 'automation', 'digital', 'of', 'transformation', 'the', 'in', 'for', 'other']","['Business France: Business France is the national agency responsible for the development of exports and international investment in France., Future of Work, Automation', 'Tesa: Tesa AG manufactures and markets self-adhesive products and system solutions for industry, trade, and consumer sectors worldwide., Future of Work, Digital Transformation, Automation', 'Smart: Smart offers its members with solutions to create a salaried job and a range of services in legal, financial, training and administration., CleanTech, Future of Work, Digital Transformation']",and - is - automation - digital - of - transformation - the - in - for - other,0.0,False
428,"Deliveroo: Deliveroo owns and operates an online food delivery platform in the United Kingdom., Digital Transformation, Future of Work",0,0_and_food_is_the,"['and', 'food', 'is', 'the', 'that', 'of', 'automation', 'products', 'in', 'stores']","['Lesara: Lesara is the leading global agile retail pioneer for amazing fashion merchandise at best prices.\r\n\r\nThe company has offices in China and Germany and since its launch in 2013 expanded into 24 markets in 7 languages across Europe, grew its assortment to more than 100.000 SKUs and the the team to over 300 employees.\r\n\r\nLesara is operating a completely vertically integrated supply chain and needs only 2 weeks from idea over design, production to product go-live for its collections.\r\n\r\nThe company was awarded as fastest growing tech-company in Europe in 2016., Digitalization', 'Next: Next is engages in the retail of clothing, footwear, accessories, and home products for men, women, and children., Automation, Digital Transformation, HealthTech', 's.Oliver: s.Oliver is an online shop for apparel and fashion., Automation, Digital Transformation, Future of Work']",and - food - is - the - that - of - automation - products - in - stores,1.0,False
429,"Dentsu Aegis Network: Dentsu Aegis Network is the first digitally native network that specializes in media, digital and creative communications services., Cybersecurity, Digital Transformation, Automation",2,2_healthtech_health_and_medical,"['healthtech', 'health', 'and', 'medical', 'healthcare', 'digital', 'transformation', 'in', 'the', 'pharmaceutical']","['Novo Nordisk: Novo Nordisk is a global healthcare company with more than 90 years of innovation and leadership in diabetes care., HealthTech, Health Care', 'University Medical Center Groningen: University Medical Center Groningen is a hospital in Groningen, The Netherlands. Its core tasks are academic health care, medical education., HealthTech, Automation', 'Fresenius Medical Care: Fresenius Medical Care is a healthcare company that provides dialysis treatment for those with chronic kidney diseases., Digital Transformation, Future of Work, Automation']",healthtech - health - and - medical - healthcare - digital - transformation - in - the - pharmaceutical,0.44128461635305155,False
430,"Deutsche Vermögensberatung AG: Germany's biggest financial advisory corporation with about 8 million customers, FinTech, Automation",-1,-1_and_is_automation_digital,"['and', 'is', 'automation', 'digital', 'of', 'transformation', 'the', 'in', 'for', 'other']","['Business France: Business France is the national agency responsible for the development of exports and international investment in France., Future of Work, Automation', 'Tesa: Tesa AG manufactures and markets self-adhesive products and system solutions for industry, trade, and consumer sectors worldwide., Future of Work, Digital Transformation, Automation', 'Smart: Smart offers its members with solutions to create a salaried job and a range of services in legal, financial, training and administration., CleanTech, Future of Work, Digital Transformation']",and - is - automation - digital - of - transformation - the - in - for - other,0.0,False
431,"Diesel: A leading pioneer in denim and casual fashion, known for moving outside and ahead of trends in its industry., Digital Transformation, Future of Work, Automation",4,4_cars_industry_of_manufacturer,"['cars', 'industry', 'of', 'manufacturer', '40', 'other', 'automotive', 'and', 'transformation', 'digital']","['Volkswagen: Leading German automotive manufacturer, Digital Transformation, Automation, Industry 4.0', 'Porsche: Leading manufacturer of high quality cars, Other, Automation, Digital Transformation', 'Daimler: Producer of premium cars and manufacturer of commercial vehicles, Other, Digital Transformation, Automation']",cars - industry - of - manufacturer - 40 - other - automotive - and - transformation - digital,1.0,False
432,"Direct Assurance: Direct Assurance est un assurance en ligne, leader de l'assurance Auto en ligne, Digital Transformation, InsurTech",7,7_insurance_insurtech_group_and,"['insurance', 'insurtech', 'group', 'and', 'direct', 'transformation', 'life', 'services', 'digital', 'fintech']","['Achmea: Achmea is an insurance company that provides its clients with health, life, and non-life insurance services., Digital Transformation, HealthTech, InsurTech', ""Lloyd's: Lloyd’s is the world’s specialist insurance market., InsurTech, FinTech, Digital Transformation"", 'Zurich Insurance Group: The Zurich Insurance Group is a multi-line insurance provider that delivers general insurance and life insurance products and services., Digital Transformation, Automation, InsurTech']",insurance - insurtech - group - and - direct - transformation - life - services - digital - fintech,0.6632877077649942,False
433,"dixons carphone: Specialist electrical and telecommunications retailer and services company, Future of Work, Other",8,8_mobile_telecommunications_services_communications,"['mobile', 'telecommunications', 'services', 'communications', 'broadband', 'fixed', 'digital', 'transformation', 'automation', 'and']","['Partner Communications Company: Partner Communications Company is a mobile network operator, internet Wi-Fi, fixed telephony service and OTT/IPTV provider in Israel., Cybersecurity, Security, HealthTech', 'SFR: SFR operates as a mobile telecommunications operator that offers mobile telephony services., Digital Transformation, Automation, HealthTech', 'Movistar: Movistar is a Spanish mobile phone operator offering fixed and mobile telephony and broadband services for its clients.\xa0, Automation, MarTech, Future of Work']",mobile - telecommunications - services - communications - broadband - fixed - digital - transformation - automation - and,0.909846063516983,False
434,"DKSH: DKSH is a market expansion services provider firm with a focus on marketing, sourcing, analysis, sales, logistic, and after-sales services., Digital Transformation, Industry 4.0, Social Good (Economy)",-1,-1_and_is_automation_digital,"['and', 'is', 'automation', 'digital', 'of', 'transformation', 'the', 'in', 'for', 'other']","['Business France: Business France is the national agency responsible for the development of exports and international investment in France., Future of Work, Automation', 'Tesa: Tesa AG manufactures and markets self-adhesive products and system solutions for industry, trade, and consumer sectors worldwide., Future of Work, Digital Transformation, Automation', 'Smart: Smart offers its members with solutions to create a salaried job and a range of services in legal, financial, training and administration., CleanTech, Future of Work, Digital Transformation']",and - is - automation - digital - of - transformation - the - in - for - other,0.0,False
435,"DNB: DNB is a financial services group that offers financial services through mobile, online banking, bank offices, and international offices., Digital Transformation",1,1_bank_fintech_financial_banking,"['bank', 'fintech', 'financial', 'banking', 'services', 'payments', 'is', 'digital', 'of', 'transformation']","['HSBC: Is a British multinational banking and financial services company, Digital Transformation, Automation, FinTech', 'The Royal Bank of Scotland: The Royal Bank of Scotland is a bank providing retail banking services throughout the United Kingdom and Ireland.\xa0, Other, FinTech, Automation', 'Deutsche Bank: Global investment bank, offers financial products and services to corporate and institutional clients, FinTech, Automation, Digital Transformation']",bank - fintech - financial - banking - services - payments - is - digital - of - transformation,0.8424968244983468,False
436,"DW Deutsche Welle: DW is a German provider of radio and television broadcasting services in Germany and internationally., Digital Transformation, Automation",-1,-1_and_is_automation_digital,"['and', 'is', 'automation', 'digital', 'of', 'transformation', 'the', 'in', 'for', 'other']","['Business France: Business France is the national agency responsible for the development of exports and international investment in France., Future of Work, Automation', 'Tesa: Tesa AG manufactures and markets self-adhesive products and system solutions for industry, trade, and consumer sectors worldwide., Future of Work, Digital Transformation, Automation', 'Smart: Smart offers its members with solutions to create a salaried job and a range of services in legal, financial, training and administration., CleanTech, Future of Work, Digital Transformation']",and - is - automation - digital - of - transformation - the - in - for - other,0.0,False
437,"Eaton Corporation: Eaton Corporation is a diversified power management company for electrical, hydraulic, and mechanical applications., Security, 3D Technology, Robotics",3,3_energy_gas_and_electricity,"['energy', 'gas', 'and', 'electricity', 'is', 'company', 'transformation', 'water', 'digital', 'the']","['Engie: ENGIE is a global energy player and an expert operator in the three key sectors of electricity, natural gas and energy services., Automation, Digital Transformation, Other', 'Veolia: Veolia group is the global leader in optimized resource management. With nearly 179,000 employees worldwide, the Group designs and provides water, waste and energy management solutions which contribute to the sustainable development of communities and industries. Through its three complementary business activities, Veolia helps to develop access to resources, preserve available resources, and to replenish them. In 2019, the Veolia group supplied 98 million people with drinking water and 67 million people with wastewater service, produced nearly 45 million megawatt hours of energy and treated 50 million metric tons of waste. Veolia Environnement (listed on Paris Euronext: VIE) recorded consolidated revenue of €27.189 billion in 2019 (USD 29.9 billion)., Digital Transformation, Automation, Smart Supply Chain', 'Equinor: Equinor is an energy company that specializes in providing oil, gas, wind energy, and solar power energy., Other, CleanTech, FinTech']",energy - gas - and - electricity - is - company - transformation - water - digital - the,0.43970638084459257,False
438,"Econocom: Econocom designs, finances and oversees companies digital transformation., Automation, Cybersecurity",-1,-1_and_is_automation_digital,"['and', 'is', 'automation', 'digital', 'of', 'transformation', 'the', 'in', 'for', 'other']","['Business France: Business France is the national agency responsible for the development of exports and international investment in France., Future of Work, Automation', 'Tesa: Tesa AG manufactures and markets self-adhesive products and system solutions for industry, trade, and consumer sectors worldwide., Future of Work, Digital Transformation, Automation', 'Smart: Smart offers its members with solutions to create a salaried job and a range of services in legal, financial, training and administration., CleanTech, Future of Work, Digital Transformation']",and - is - automation - digital - of - transformation - the - in - for - other,0.0,False
