,Document,Topic,Name,Representation,Representative_Docs,Top_n_words,Probability,Representative_document
645,"CECONOMY: CECONOMY AG is the leading European platform for companies, concepts and brands in the field of consumer electronics., FinTech",-1,-1_and_is_automation_digital,"['and', 'is', 'automation', 'digital', 'of', 'transformation', 'the', 'in', 'for', 'other']","['Business France: Business France is the national agency responsible for the development of exports and international investment in France., Future of Work, Automation', 'Tesa: Tesa AG manufactures and markets self-adhesive products and system solutions for industry, trade, and consumer sectors worldwide., Future of Work, Digital Transformation, Automation', 'Smart: Smart offers its members with solutions to create a salaried job and a range of services in legal, financial, training and administration., CleanTech, Future of Work, Digital Transformation']",and - is - automation - digital - of - transformation - the - in - for - other,0.0,False
646,"CERTEGO: CERTEGO is the right partner in the security solution for those who have business in Sweden or across borders in Scandinavia., Digital Transformation",-1,-1_and_is_automation_digital,"['and', 'is', 'automation', 'digital', 'of', 'transformation', 'the', 'in', 'for', 'other']","['Business France: Business France is the national agency responsible for the development of exports and international investment in France., Future of Work, Automation', 'Tesa: Tesa AG manufactures and markets self-adhesive products and system solutions for industry, trade, and consumer sectors worldwide., Future of Work, Digital Transformation, Automation', 'Smart: Smart offers its members with solutions to create a salaried job and a range of services in legal, financial, training and administration., CleanTech, Future of Work, Digital Transformation']",and - is - automation - digital - of - transformation - the - in - for - other,0.0,False
647,"Club Med: Club Med sells vacations and related services, operates villages and cruises, and provides tours and discovery programs., New Mobility, Digital Transformation",2,2_healthtech_health_and_medical,"['healthtech', 'health', 'and', 'medical', 'healthcare', 'digital', 'transformation', 'in', 'the', 'pharmaceutical']","['Novo Nordisk: Novo Nordisk is a global healthcare company with more than 90 years of innovation and leadership in diabetes care., HealthTech, Health Care', 'University Medical Center Groningen: University Medical Center Groningen is a hospital in Groningen, The Netherlands. Its core tasks are academic health care, medical education., HealthTech, Automation', 'Fresenius Medical Care: Fresenius Medical Care is a healthcare company that provides dialysis treatment for those with chronic kidney diseases., Digital Transformation, Future of Work, Automation']",healthtech - health - and - medical - healthcare - digital - transformation - in - the - pharmaceutical,1.0,False
648,"Coast: Coast sells high end and upscale clothing and accessories via its website., Automation, Smart Supply Chain",0,0_and_food_is_the,"['and', 'food', 'is', 'the', 'that', 'of', 'automation', 'products', 'in', 'stores']","['Lesara: Lesara is the leading global agile retail pioneer for amazing fashion merchandise at best prices.\r\n\r\nThe company has offices in China and Germany and since its launch in 2013 expanded into 24 markets in 7 languages across Europe, grew its assortment to more than 100.000 SKUs and the the team to over 300 employees.\r\n\r\nLesara is operating a completely vertically integrated supply chain and needs only 2 weeks from idea over design, production to product go-live for its collections.\r\n\r\nThe company was awarded as fastest growing tech-company in Europe in 2016., Digitalization', 'Next: Next is engages in the retail of clothing, footwear, accessories, and home products for men, women, and children., Automation, Digital Transformation, HealthTech', 's.Oliver: s.Oliver is an online shop for apparel and fashion., Automation, Digital Transformation, Future of Work']",and - food - is - the - that - of - automation - products - in - stores,1.0,False
649,"concardis: Cashless payments provider, FinTech",1,1_bank_fintech_financial_banking,"['bank', 'fintech', 'financial', 'banking', 'services', 'payments', 'is', 'digital', 'of', 'transformation']","['HSBC: Is a British multinational banking and financial services company, Digital Transformation, Automation, FinTech', 'The Royal Bank of Scotland: The Royal Bank of Scotland is a bank providing retail banking services throughout the United Kingdom and Ireland.\xa0, Other, FinTech, Automation', 'Deutsche Bank: Global investment bank, offers financial products and services to corporate and institutional clients, FinTech, Automation, Digital Transformation']",bank - fintech - financial - banking - services - payments - is - digital - of - transformation,0.6507415598615464,False
650,"COWI: COWI is one of Sweden's leading technology consulting firm., Future of Work",11,11_consulting_manpower_automation_and,"['consulting', 'manpower', 'automation', 'and', 'recruitment', 'services', 'solutions', 'technology', 'management', 'business']","['Atos: Consulting services and solutions, ranging from supporting strategy development to enterprise solutions and technology, Automation, Digital Transformation, Future of Work', 'Randstad: Randstad is a global solutions provider in staffing and recruitment consultancy and placing talent in permanent and temporary job positions., Digital Transformation, Automation, Future of Work', 'Manpower: Manpower is a job recruitment firm engaged in providing Manpower, and talent solutions to the clients., Digital Transformation, Automation, Future of Work']",consulting - manpower - automation - and - recruitment - services - solutions - technology - management - business,0.9976832107858261,False
651,"creditplus: Credit Plus delivers the information and services mortgage professionals, New Mobility, CleanTech, Smart Supply Chain",1,1_bank_fintech_financial_banking,"['bank', 'fintech', 'financial', 'banking', 'services', 'payments', 'is', 'digital', 'of', 'transformation']","['HSBC: Is a British multinational banking and financial services company, Digital Transformation, Automation, FinTech', 'The Royal Bank of Scotland: The Royal Bank of Scotland is a bank providing retail banking services throughout the United Kingdom and Ireland.\xa0, Other, FinTech, Automation', 'Deutsche Bank: Global investment bank, offers financial products and services to corporate and institutional clients, FinTech, Automation, Digital Transformation']",bank - fintech - financial - banking - services - payments - is - digital - of - transformation,0.5705476834791758,False
652,"CSEM: CSEM is a private Swiss research and technology organization specializing in micro- and nanotechnology., Digital Transformation",-1,-1_and_is_automation_digital,"['and', 'is', 'automation', 'digital', 'of', 'transformation', 'the', 'in', 'for', 'other']","['Business France: Business France is the national agency responsible for the development of exports and international investment in France., Future of Work, Automation', 'Tesa: Tesa AG manufactures and markets self-adhesive products and system solutions for industry, trade, and consumer sectors worldwide., Future of Work, Digital Transformation, Automation', 'Smart: Smart offers its members with solutions to create a salaried job and a range of services in legal, financial, training and administration., CleanTech, Future of Work, Digital Transformation']",and - is - automation - digital - of - transformation - the - in - for - other,0.0,False
653,"damco: Manufacturer of dowel basket assemblies for jointed paving and highway construction, Automation, Smart Supply Chain",-1,-1_and_is_automation_digital,"['and', 'is', 'automation', 'digital', 'of', 'transformation', 'the', 'in', 'for', 'other']","['Business France: Business France is the national agency responsible for the development of exports and international investment in France., Future of Work, Automation', 'Tesa: Tesa AG manufactures and markets self-adhesive products and system solutions for industry, trade, and consumer sectors worldwide., Future of Work, Digital Transformation, Automation', 'Smart: Smart offers its members with solutions to create a salaried job and a range of services in legal, financial, training and administration., CleanTech, Future of Work, Digital Transformation']",and - is - automation - digital - of - transformation - the - in - for - other,0.0,False
654,"Dassault Aviation: Dassault Aviation is an aircraft manufacturer of military, regional, and business jets., Other",-1,-1_and_is_automation_digital,"['and', 'is', 'automation', 'digital', 'of', 'transformation', 'the', 'in', 'for', 'other']","['Business France: Business France is the national agency responsible for the development of exports and international investment in France., Future of Work, Automation', 'Tesa: Tesa AG manufactures and markets self-adhesive products and system solutions for industry, trade, and consumer sectors worldwide., Future of Work, Digital Transformation, Automation', 'Smart: Smart offers its members with solutions to create a salaried job and a range of services in legal, financial, training and administration., CleanTech, Future of Work, Digital Transformation']",and - is - automation - digital - of - transformation - the - in - for - other,0.0,False
655,"Deichmann: A major German shoe and sportswear retail chain, Digitalization",0,0_and_food_is_the,"['and', 'food', 'is', 'the', 'that', 'of', 'automation', 'products', 'in', 'stores']","['Lesara: Lesara is the leading global agile retail pioneer for amazing fashion merchandise at best prices.\r\n\r\nThe company has offices in China and Germany and since its launch in 2013 expanded into 24 markets in 7 languages across Europe, grew its assortment to more than 100.000 SKUs and the the team to over 300 employees.\r\n\r\nLesara is operating a completely vertically integrated supply chain and needs only 2 weeks from idea over design, production to product go-live for its collections.\r\n\r\nThe company was awarded as fastest growing tech-company in Europe in 2016., Digitalization', 'Next: Next is engages in the retail of clothing, footwear, accessories, and home products for men, women, and children., Automation, Digital Transformation, HealthTech', 's.Oliver: s.Oliver is an online shop for apparel and fashion., Automation, Digital Transformation, Future of Work']",and - food - is - the - that - of - automation - products - in - stores,0.9514126557684436,False
656,"Demcon: Demcon supplies high-end technology products and systems such as optomechatronic, robotic and medical systems., HealthTech",-1,-1_and_is_automation_digital,"['and', 'is', 'automation', 'digital', 'of', 'transformation', 'the', 'in', 'for', 'other']","['Business France: Business France is the national agency responsible for the development of exports and international investment in France., Future of Work, Automation', 'Tesa: Tesa AG manufactures and markets self-adhesive products and system solutions for industry, trade, and consumer sectors worldwide., Future of Work, Digital Transformation, Automation', 'Smart: Smart offers its members with solutions to create a salaried job and a range of services in legal, financial, training and administration., CleanTech, Future of Work, Digital Transformation']",and - is - automation - digital - of - transformation - the - in - for - other,0.0,False
657,"Deutsche Börse: Deutsche Borse is an exchange company providing investors, financial institutions and companies with access to global capital markets., Security, Cybersecurity",1,1_bank_fintech_financial_banking,"['bank', 'fintech', 'financial', 'banking', 'services', 'payments', 'is', 'digital', 'of', 'transformation']","['HSBC: Is a British multinational banking and financial services company, Digital Transformation, Automation, FinTech', 'The Royal Bank of Scotland: The Royal Bank of Scotland is a bank providing retail banking services throughout the United Kingdom and Ireland.\xa0, Other, FinTech, Automation', 'Deutsche Bank: Global investment bank, offers financial products and services to corporate and institutional clients, FinTech, Automation, Digital Transformation']",bank - fintech - financial - banking - services - payments - is - digital - of - transformation,0.48805764479735486,False
658,"Diehl: A worldwide leading specialist for the design and production of control systems., Industry 4.0",4,4_cars_industry_of_manufacturer,"['cars', 'industry', 'of', 'manufacturer', '40', 'other', 'automotive', 'and', 'transformation', 'digital']","['Volkswagen: Leading German automotive manufacturer, Digital Transformation, Automation, Industry 4.0', 'Porsche: Leading manufacturer of high quality cars, Other, Automation, Digital Transformation', 'Daimler: Producer of premium cars and manufacturer of commercial vehicles, Other, Digital Transformation, Automation']",cars - industry - of - manufacturer - 40 - other - automotive - and - transformation - digital,0.6049421100993684,False
659,"DocMorris: Doc Morris is an online provider of medical and pharmaceutical products., FinTech",2,2_healthtech_health_and_medical,"['healthtech', 'health', 'and', 'medical', 'healthcare', 'digital', 'transformation', 'in', 'the', 'pharmaceutical']","['Novo Nordisk: Novo Nordisk is a global healthcare company with more than 90 years of innovation and leadership in diabetes care., HealthTech, Health Care', 'University Medical Center Groningen: University Medical Center Groningen is a hospital in Groningen, The Netherlands. Its core tasks are academic health care, medical education., HealthTech, Automation', 'Fresenius Medical Care: Fresenius Medical Care is a healthcare company that provides dialysis treatment for those with chronic kidney diseases., Digital Transformation, Future of Work, Automation']",healthtech - health - and - medical - healthcare - digital - transformation - in - the - pharmaceutical,0.8743839080444851,False
660,"Dr Martens: Dr. Martens US store for boots, shoes, sandals, clothing, bags and accessories., HealthTech",0,0_and_food_is_the,"['and', 'food', 'is', 'the', 'that', 'of', 'automation', 'products', 'in', 'stores']","['Lesara: Lesara is the leading global agile retail pioneer for amazing fashion merchandise at best prices.\r\n\r\nThe company has offices in China and Germany and since its launch in 2013 expanded into 24 markets in 7 languages across Europe, grew its assortment to more than 100.000 SKUs and the the team to over 300 employees.\r\n\r\nLesara is operating a completely vertically integrated supply chain and needs only 2 weeks from idea over design, production to product go-live for its collections.\r\n\r\nThe company was awarded as fastest growing tech-company in Europe in 2016., Digitalization', 'Next: Next is engages in the retail of clothing, footwear, accessories, and home products for men, women, and children., Automation, Digital Transformation, HealthTech', 's.Oliver: s.Oliver is an online shop for apparel and fashion., Automation, Digital Transformation, Future of Work']",and - food - is - the - that - of - automation - products - in - stores,1.0,False
661,"Dunelm: Dunelm is the UK's home furnishing retailers. Shop for bedding, curtains, furniture, beds, and mattresses., Automation",0,0_and_food_is_the,"['and', 'food', 'is', 'the', 'that', 'of', 'automation', 'products', 'in', 'stores']","['Lesara: Lesara is the leading global agile retail pioneer for amazing fashion merchandise at best prices.\r\n\r\nThe company has offices in China and Germany and since its launch in 2013 expanded into 24 markets in 7 languages across Europe, grew its assortment to more than 100.000 SKUs and the the team to over 300 employees.\r\n\r\nLesara is operating a completely vertically integrated supply chain and needs only 2 weeks from idea over design, production to product go-live for its collections.\r\n\r\nThe company was awarded as fastest growing tech-company in Europe in 2016., Digitalization', 'Next: Next is engages in the retail of clothing, footwear, accessories, and home products for men, women, and children., Automation, Digital Transformation, HealthTech', 's.Oliver: s.Oliver is an online shop for apparel and fashion., Automation, Digital Transformation, Future of Work']",and - food - is - the - that - of - automation - products - in - stores,1.0,False
662,"Dürr Systems: Durr is a mechanical and plant engineering firm for automobile manufacturing., New Mobility",4,4_cars_industry_of_manufacturer,"['cars', 'industry', 'of', 'manufacturer', '40', 'other', 'automotive', 'and', 'transformation', 'digital']","['Volkswagen: Leading German automotive manufacturer, Digital Transformation, Automation, Industry 4.0', 'Porsche: Leading manufacturer of high quality cars, Other, Automation, Digital Transformation', 'Daimler: Producer of premium cars and manufacturer of commercial vehicles, Other, Digital Transformation, Automation']",cars - industry - of - manufacturer - 40 - other - automotive - and - transformation - digital,1.0,False
663,"Edenred: Edenred is a leading services and payments platform and the everyday companion for people at work, FinTech, Digital Transformation",1,1_bank_fintech_financial_banking,"['bank', 'fintech', 'financial', 'banking', 'services', 'payments', 'is', 'digital', 'of', 'transformation']","['HSBC: Is a British multinational banking and financial services company, Digital Transformation, Automation, FinTech', 'The Royal Bank of Scotland: The Royal Bank of Scotland is a bank providing retail banking services throughout the United Kingdom and Ireland.\xa0, Other, FinTech, Automation', 'Deutsche Bank: Global investment bank, offers financial products and services to corporate and institutional clients, FinTech, Automation, Digital Transformation']",bank - fintech - financial - banking - services - payments - is - digital - of - transformation,0.31919239893074786,False
664,"Egmont: Egmont is a media production company., Other",5,5_media_news_radio_digital,"['media', 'news', 'radio', 'digital', 'martech', 'transformation', 'automation', 'is', 'channel', 'of']","['France 24: France 24 is an international news and current affairs television channel that offers a French perspective on world events., Digital Transformation, New Mobility', 'Bonnier: Bonnier is a media group working in TV, daily newspapers, business and trade press, magazines, film, books, radio and digital media., Digital Transformation, Automation', 'ProSiebenSat.1 Media SE: ProSiebenSat.1 Media SE is a mass media company operating television, radio stations and print businesses., Digitalization, MarTech, Automation']",media - news - radio - digital - martech - transformation - automation - is - channel - of,0.9911212720755975,False
665,"Endemol Shine Group: Endemol Shine Group is a global production powerhouse creating world class content for all platforms., Automation",-1,-1_and_is_automation_digital,"['and', 'is', 'automation', 'digital', 'of', 'transformation', 'the', 'in', 'for', 'other']","['Business France: Business France is the national agency responsible for the development of exports and international investment in France., Future of Work, Automation', 'Tesa: Tesa AG manufactures and markets self-adhesive products and system solutions for industry, trade, and consumer sectors worldwide., Future of Work, Digital Transformation, Automation', 'Smart: Smart offers its members with solutions to create a salaried job and a range of services in legal, financial, training and administration., CleanTech, Future of Work, Digital Transformation']",and - is - automation - digital - of - transformation - the - in - for - other,0.0,False
666,"ERDF: ERDF manages the public electricity distribution network for 95% of continental France., Automation",3,3_energy_gas_and_electricity,"['energy', 'gas', 'and', 'electricity', 'is', 'company', 'transformation', 'water', 'digital', 'the']","['Engie: ENGIE is a global energy player and an expert operator in the three key sectors of electricity, natural gas and energy services., Automation, Digital Transformation, Other', 'Veolia: Veolia group is the global leader in optimized resource management. With nearly 179,000 employees worldwide, the Group designs and provides water, waste and energy management solutions which contribute to the sustainable development of communities and industries. Through its three complementary business activities, Veolia helps to develop access to resources, preserve available resources, and to replenish them. In 2019, the Veolia group supplied 98 million people with drinking water and 67 million people with wastewater service, produced nearly 45 million megawatt hours of energy and treated 50 million metric tons of waste. Veolia Environnement (listed on Paris Euronext: VIE) recorded consolidated revenue of €27.189 billion in 2019 (USD 29.9 billion)., Digital Transformation, Automation, Smart Supply Chain', 'Equinor: Equinor is an energy company that specializes in providing oil, gas, wind energy, and solar power energy., Other, CleanTech, FinTech']",energy - gas - and - electricity - is - company - transformation - water - digital - the,0.6704524667754163,False
667,"Essent: Essent, Other",0,0_and_food_is_the,"['and', 'food', 'is', 'the', 'that', 'of', 'automation', 'products', 'in', 'stores']","['Lesara: Lesara is the leading global agile retail pioneer for amazing fashion merchandise at best prices.\r\n\r\nThe company has offices in China and Germany and since its launch in 2013 expanded into 24 markets in 7 languages across Europe, grew its assortment to more than 100.000 SKUs and the the team to over 300 employees.\r\n\r\nLesara is operating a completely vertically integrated supply chain and needs only 2 weeks from idea over design, production to product go-live for its collections.\r\n\r\nThe company was awarded as fastest growing tech-company in Europe in 2016., Digitalization', 'Next: Next is engages in the retail of clothing, footwear, accessories, and home products for men, women, and children., Automation, Digital Transformation, HealthTech', 's.Oliver: s.Oliver is an online shop for apparel and fashion., Automation, Digital Transformation, Future of Work']",and - food - is - the - that - of - automation - products - in - stores,0.9931770840688179,False
668,"euronics: An international organisation of independent electrical retailers who have joined together to form a cooperative partnership., Digital Transformation, Smart Supply Chain",-1,-1_and_is_automation_digital,"['and', 'is', 'automation', 'digital', 'of', 'transformation', 'the', 'in', 'for', 'other']","['Business France: Business France is the national agency responsible for the development of exports and international investment in France., Future of Work, Automation', 'Tesa: Tesa AG manufactures and markets self-adhesive products and system solutions for industry, trade, and consumer sectors worldwide., Future of Work, Digital Transformation, Automation', 'Smart: Smart offers its members with solutions to create a salaried job and a range of services in legal, financial, training and administration., CleanTech, Future of Work, Digital Transformation']",and - is - automation - digital - of - transformation - the - in - for - other,0.0,False
669,"Europa Press: EUROPA PRESS provides Spanish communication and news services on national, international, economic, sports, and health issues., Automation",5,5_media_news_radio_digital,"['media', 'news', 'radio', 'digital', 'martech', 'transformation', 'automation', 'is', 'channel', 'of']","['France 24: France 24 is an international news and current affairs television channel that offers a French perspective on world events., Digital Transformation, New Mobility', 'Bonnier: Bonnier is a media group working in TV, daily newspapers, business and trade press, magazines, film, books, radio and digital media., Digital Transformation, Automation', 'ProSiebenSat.1 Media SE: ProSiebenSat.1 Media SE is a mass media company operating television, radio stations and print businesses., Digitalization, MarTech, Automation']",media - news - radio - digital - martech - transformation - automation - is - channel - of,1.0,False
670,"Eutelsat: Eutelsat is a commercial satellite provider with coverage spanning the European continent, the Middle East, Africa India, and the Americas., Other",-1,-1_and_is_automation_digital,"['and', 'is', 'automation', 'digital', 'of', 'transformation', 'the', 'in', 'for', 'other']","['Business France: Business France is the national agency responsible for the development of exports and international investment in France., Future of Work, Automation', 'Tesa: Tesa AG manufactures and markets self-adhesive products and system solutions for industry, trade, and consumer sectors worldwide., Future of Work, Digital Transformation, Automation', 'Smart: Smart offers its members with solutions to create a salaried job and a range of services in legal, financial, training and administration., CleanTech, Future of Work, Digital Transformation']",and - is - automation - digital - of - transformation - the - in - for - other,0.0,False
